{
  "schema": 1,
  "scope": "configuration",
  "subject": "DLC Merger 2.1, Black Pits in BG 1.2.1, and Dark Horizons 3.06 English defaults on clean BGEE 2.6.6",
  "identity": {
    "registry_revision": "4bb2fec",
    "platform": "windows",
    "weidu_version": "25100",
    "lock_sha256": "285f2c473754df4bca3504df98fbec0e754bc89ccb31c8c6435d46b6234e1234",
    "environments": {
      "target": {
        "target": "bgee",
        "fingerprint": {
          "profile": "iepm-core-layout-v1",
          "value": "04fc6602150ff7788875573dbf0b7f4aeb7ca26aaf83b022c77d9fc417d848c3"
        }
      }
    },
    "packages": [
      { "package": "dlc-merger", "release_id": "dlc-merger-2.1-win32", "environment": "target", "artifact_sha256": "16b57b32662c1ac1e6d345afaf8669e01cf26eeafc5461000757edf33447e2eb", "components": ["merge-sod"] },
      { "package": "bp-in-bg", "release_id": "bp-in-bg-1.2.1-source", "environment": "target", "artifact_sha256": "231929cf1df4009a0712a85a57ef6f4ff562b2ba0afb9e15c04918a9e085dab8", "components": ["black-pits-campaign-access"] },
      { "package": "dark-horizons", "release_id": "dark-horizons-v3.06-source", "environment": "target", "artifact_sha256": "977e7771c9717e3139e96d261279c7337fcfd062fb5ea6b0efdedddc2c8ee9c2", "components": ["dark-horizons-quests"] }
    ],
    "execution_order": ["dlc-merger", "bp-in-bg", "dark-horizons"]
  },
  "checks": {
    "artifact_verified": true,
    "selector_known": true,
    "requirements_modeled": true,
    "component_catalog_complete": true,
    "all_components_classified": true,
    "core_components_supported": false,
    "selected_components_supported": false,
    "relationships_satisfied": true,
    "no_opaque_selections": true,
    "clean_disposable_install": true,
    "all_actions_completed": true,
    "requested_components_recorded": true,
    "no_components_skipped": true,
    "warnings_classified": true,
    "sealed": true,
    "eet_end_required": false,
    "main_menu_smoke": false,
    "gameplay_smoke": false
  },
  "evidence": ["examples/bgee-black-pits-dark-horizons/modpack.yaml", "docs/pa4-bgee-black-pits-dark-horizons-evidence.md"]
}
