{
  "schema": 1,
  "scope": "configuration",
  "subject": "Romantic Encounters BG2 v15 reactions, Ada, Aimi, and Aran on clean BG2EE 2.6.6",
  "identity": {
    "registry_revision": "50e167c",
    "platform": "windows",
    "weidu_version": "25100",
    "lock_sha256": "43700b3889dc4a14023e17312a7018c12a89103934b88462cc5206be3aaeb72a",
    "environments": { "target": { "target": "bg2ee", "fingerprint": { "profile": "iepm-core-layout-v1", "value": "298c1d1eb13f7d5f934aaa25f868679a03fd8bfd7f13028b2646e29a4a10ff2f" } } },
    "packages": [
      { "package": "bg2-romantic-encounters", "release_id": "bg2-romantic-encounters-v15-source", "environment": "target", "artifact_sha256": "66eb5761124da3253fe78344bbfc4545cda83ce46a70c3ee072eaa5909bfb5f3", "components": ["reactions", "ada", "aimi", "aran"] }
    ],
    "execution_order": ["bg2-romantic-encounters"]
  },
  "checks": {
    "artifact_verified": true, "selector_known": true, "requirements_modeled": true,
    "component_catalog_complete": true, "all_components_classified": true,
    "core_components_supported": false, "selected_components_supported": false,
    "relationships_satisfied": true, "no_opaque_selections": true,
    "clean_disposable_install": true, "all_actions_completed": true,
    "requested_components_recorded": true, "no_components_skipped": true,
    "warnings_classified": true, "sealed": true, "eet_end_required": false,
    "main_menu_smoke": false, "gameplay_smoke": false
  },
  "evidence": ["examples/bg2ee-romantic-encounters/modpack.yaml", "docs/pa4-bg2ee-romantic-encounters-evidence.md"]
}
