{
  "schema": 1,
  "scope": "configuration",
  "subject": "Unfinished Business v28 three English restoration choices on clean BG2EE 2.6.6",
  "identity": {
    "registry_revision": "b0c9d0f",
    "platform": "windows",
    "weidu_version": "25100",
    "lock_sha256": "eb19e4ab1efd95bf284190333213eeadd8b4f91d1cb47b58bdfc8ae32df9c927",
    "environments": {
      "target": {
        "target": "bg2ee",
        "fingerprint": {
          "profile": "iepm-core-layout-v1",
          "value": "298c1d1eb13f7d5f934aaa25f868679a03fd8bfd7f13028b2646e29a4a10ff2f"
        }
      }
    },
    "packages": [
      { "package": "unfinished-business-bg2", "release_id": "unfinished-business-bg2-v28-source", "environment": "target", "artifact_sha256": "953b849329626a50e8de5927170c927b1ade0641f409aa83be2a6b63fd0b0203", "components": ["kidnapping-of-boo", "item-restorations", "minor-dialogs"] }
    ],
    "execution_order": ["unfinished-business-bg2"]
  },
  "checks": {
    "artifact_verified": true,
    "selector_known": true,
    "requirements_modeled": true,
    "component_catalog_complete": true,
    "all_components_classified": true,
    "core_components_supported": true,
    "selected_components_supported": true,
    "relationships_satisfied": true,
    "no_opaque_selections": true,
    "clean_disposable_install": true,
    "all_actions_completed": true,
    "requested_components_recorded": true,
    "no_components_skipped": true,
    "warnings_classified": true,
    "sealed": true,
    "eet_end_required": false,
    "main_menu_smoke": true,
    "gameplay_smoke": false
  },
  "evidence": ["examples/bg2ee-unfinished-business/modpack.yaml", "docs/pa4-bg2ee-unfinished-business-evidence.md"]
}
