{
  "schema": 1,
  "scope": "configuration",
  "subject": "Northern Tales of the Sword Coast v5.0.0 main after DLC Merger on clean SoD-enabled BGEE 2.6.6",
  "identity": {
    "registry_revision": "f016841",
    "platform": "windows",
    "weidu_version": "25100",
    "lock_sha256": "5e6bc198c25c73874d8a063504760d8a36e32b775a8626ffbed1c46f774367e3",
    "environments": { "target": { "target": "bgee", "fingerprint": { "profile": "iepm-core-layout-v1", "value": "04fc6602150ff7788875573dbf0b7f4aeb7ca26aaf83b022c77d9fc417d848c3" } } },
    "packages": [
      { "package": "dlc-merger", "release_id": "dlc-merger-2.1-win32", "environment": "target", "artifact_sha256": "16b57b32662c1ac1e6d345afaf8669e01cf26eeafc5461000757edf33447e2eb", "components": ["merge-sod"] },
      { "package": "northern-tales-of-the-sword-coast", "release_id": "ntotsc-v5.0.0-source", "environment": "target", "artifact_sha256": "6df6f6b4e94f0d5b3d087502be7f042d62e6830eb3566f54c554af3451c63db1", "components": ["northern-tales"] }
    ],
    "execution_order": ["dlc-merger", "northern-tales-of-the-sword-coast"]
  },
  "checks": {
    "artifact_verified": true, "selector_known": true, "requirements_modeled": true,
    "component_catalog_complete": true, "all_components_classified": true,
    "core_components_supported": false, "selected_components_supported": false,
    "relationships_satisfied": true, "no_opaque_selections": true,
    "clean_disposable_install": true, "all_actions_completed": true,
    "requested_components_recorded": true, "no_components_skipped": true,
    "warnings_classified": true, "sealed": true, "eet_end_required": false,
    "main_menu_smoke": false, "gameplay_smoke": false
  },
  "evidence": ["examples/bgee-northern-tales/modpack.yaml", "docs/pa4-bgee-northern-tales-evidence.md"]
}
