{
  "schema": 1,
  "scope": "configuration",
  "subject": "Isra NPC for BGII v3.1 English main on clean BG2EE 2.6.6",
  "identity": {
    "registry_revision": "15ba451",
    "platform": "windows",
    "weidu_version": "25100",
    "lock_sha256": "b7db7468b575b98af7467822ac085ffe9781d616af9e97801cd94ee866479678",
    "environments": {
      "target": {
        "target": "bg2ee",
        "fingerprint": {
          "profile": "iepm-core-layout-v1",
          "value": "298c1d1eb13f7d5f934aaa25f868679a03fd8bfd7f13028b2646e29a4a10ff2f"
        }
      }
    },
    "packages": [
      { "package": "isra-bg2", "release_id": "isra-bg2-v3.1-source", "environment": "target", "artifact_sha256": "45bd7011bdb30ef2b4759ac9a8fa2a4a25711efa545efbfc2b0c20841180a8a8", "components": ["isra-bg2-npc"] }
    ],
    "execution_order": ["isra-bg2"]
  },
  "checks": {
    "artifact_verified": true,
    "selector_known": true,
    "requirements_modeled": true,
    "component_catalog_complete": true,
    "all_components_classified": true,
    "core_components_supported": true,
    "selected_components_supported": true,
    "relationships_satisfied": true,
    "no_opaque_selections": true,
    "clean_disposable_install": true,
    "all_actions_completed": true,
    "requested_components_recorded": true,
    "no_components_skipped": true,
    "warnings_classified": true,
    "sealed": true,
    "eet_end_required": false,
    "main_menu_smoke": true,
    "gameplay_smoke": false
  },
  "evidence": ["examples/bg2ee-isra-bg2/modpack.yaml", "docs/pa4-bg2ee-isra-bg2-evidence.md"]
}
