{
  "schema": 1,
  "scope": "configuration",
  "subject": "BG1 Romantic Encounters v16 adult BG-style/show-warnings and all forty-four English encounters on clean SoD-enabled BGEE 2.6.6",
  "identity": {
    "registry_revision": "14cdebd",
    "platform": "windows",
    "weidu_version": "25100",
    "lock_sha256": "3676422903a4223474e7f1536f6d42257d8b16194d21d227da0fde1373a1bd9e",
    "environments": { "target": { "target": "bgee", "fingerprint": { "profile": "iepm-core-layout-v1", "value": "04fc6602150ff7788875573dbf0b7f4aeb7ca26aaf83b022c77d9fc417d848c3" } } },
    "packages": [
      { "package": "dlc-merger", "release_id": "dlc-merger-2.1-win32", "environment": "target", "artifact_sha256": "16b57b32662c1ac1e6d345afaf8669e01cf26eeafc5461000757edf33447e2eb", "components": ["merge-sod"] },
      { "package": "bg1-romantic-encounters", "release_id": "bg1-romantic-encounters-v16-source", "environment": "target", "artifact_sha256": "83ab63ca9521c6edd736b50ae3b704832b45036625c337e6754869962f7e493f", "components": ["adult-bg-style-show-warnings", "bardolans-briefing", "scars-spare-time", "kims-preoccupation", "extention-of-bjornin-encounter", "no-starch-in-maypole", "duke-eltans-spare-minute", "husams-personal-preparation", "laurels-post-hunting", "bartus-seduction", "linas-massage", "bg1re-first-night-quentin", "chatting-niklos-up", "slythe-and-kristin", "no-regrets", "purchased-love", "hull-heavy-duty", "late-night-jaheira", "sils-blessing", "melicamp-poultry-boy", "reading-with-rinnie", "molly-husband-grabber", "mourning-of-centeol", "essential-end", "harvestmen-lair", "great-zudini", "messenger", "ender-sai-heros-reward", "the-novellists", "honest-lies-of-two-riversides", "necromancers-trouble", "dinner-with-thalantyr", "gender-girdle-reactions", "surgeons-dream", "what-left-was", "childhood-friend", "arlene-working-girl", "della-may-from-thay", "dirty-guard-candlekeep", "phoenix-flame", "mikala-the-monk", "the-messenger-2", "camryn-and-tamah", "minor-disclosures", "cloakwood-lovers"] }
    ],
    "execution_order": ["dlc-merger", "bg1-romantic-encounters"]
  },
  "checks": {
    "artifact_verified": true, "selector_known": true, "requirements_modeled": false,
    "component_catalog_complete": true, "all_components_classified": true,
    "core_components_supported": false, "selected_components_supported": false,
    "relationships_satisfied": true, "no_opaque_selections": true,
    "clean_disposable_install": true, "all_actions_completed": true,
    "requested_components_recorded": true, "no_components_skipped": true,
    "warnings_classified": true, "sealed": true, "eet_end_required": false,
    "main_menu_smoke": false, "gameplay_smoke": false
  },
  "evidence": ["examples/bgee-bg1-romantic-encounters/modpack.yaml", "docs/pa4-bg1-romantic-encounters-evidence.md"]
}
